{
  "schema_id": "ctxvault.context-health-report/v0",
  "report_id": "context_health_example",
  "generated_at": "2026-05-16T00:00:00Z",
  "scanned_path": "fixtures/v0.6.2-context-health-doctor/sample-repo",
  "mode": "read_only_local_scan",
  "output_policy": {
    "output_root": ".ctxvault/health",
    "health_root": ".ctxvault/health",
    "backup_root": ".ctxvault/backups/context-health-doctor",
    "raw_source_copied": false,
    "target_files_written": false
  },
  "decision_table": {
    "claim": {
      "status": "blocked",
      "reason": "Unsupported public claim language is present.",
      "next_check": "Attach source facts and claim-lint receipts before publication.",
      "rollback": "Delete or supersede the generated report."
    },
    "context": {
      "status": "blocked",
      "reason": "Conflicting instruction versions are present.",
      "next_check": "Resolve AGENTS.md and CLAUDE.md before agent consumption.",
      "rollback": "Delete or supersede the generated report."
    },
    "memory": {
      "status": "blocked",
      "reason": "Memory summary lacks raw refs and rollback.",
      "next_check": "Add raw refs, lifecycle state, and rollback refs.",
      "rollback": "Delete or supersede the generated report."
    },
    "action": {
      "status": "blocked",
      "reason": "Publication/action language lacks sufficient evidence.",
      "next_check": "Add approval receipt and rollback before action.",
      "rollback": "Delete or supersede the generated report."
    }
  },
  "summary": {
    "finding_count": 1,
    "severity_counts": {
      "high": 1
    },
    "finding_type_counts": {
      "unsupported_claim": 1
    }
  },
  "findings": [
    {
      "finding_id": "chf_example_001",
      "source_ref": "file://docs/public-claims.md",
      "finding_type": "unsupported_claim",
      "authority_layer_affected": ["claim"],
      "severity": "high",
      "reason": "Stable MGP and security completeness claims require evidence.",
      "safe_rewrite_or_next_check": "Downgrade to private experimental wording or attach receipts.",
      "rollback_ref": "delete://.ctxvault/health/runs/context_health_example"
    }
  ],
  "evidence": {
    "selected_refs": ["file://docs/public-claims.md"],
    "omitted_refs": [],
    "blocked_refs": ["file://docs/public-claims.md"],
    "stale_refs": [],
    "conflicting_refs": [],
    "caveated_refs": []
  },
  "side_effects": {
    "network_fetch_performed": false,
    "provider_or_model_call_performed": false,
    "runtime_or_adapter_executed": false,
    "browser_or_cloud_state_read": false,
    "mcp_server_started": false,
    "target_file_written": false,
    "memory_promotion_performed": false,
    "raw_source_copied": false,
    "public_publication_performed": false,
    "stable_protocol_claim": false
  },
  "rollback": {
    "rollback_ref": "delete://.ctxvault/health/runs/context_health_example",
    "delete_paths": [".ctxvault/health/runs/context_health_example"],
    "supersede_with": "Regenerate the report after resolving findings."
  }
}
